{
  "task_id": "TASK_12E8E0341E85",
  "executor": "jarvis_gateway_to_orchestrator",
  "start_time": "2026-09-29T08:12:52.732210+00:00",
  "end_time": "2026-09-29T08:12:52.732210+00:00",
  "files_read": [],
  "files_changed": [],
  "tools_or_commands": [
    "pytest",
    "independent_verifier"
  ],
  "artifacts_created": [
    "jarvis_access_layer_v1_event_trace.json"
  ],
  "tests": {
    "ran": true,
    "passed": 11,
    "failed": 0
  },
  "verifier": {
    "ran": true,
    "passed": true,
    "errors": []
  },
  "commit": null,
  "push_status": "NOT_PUSHED",
  "decision": "JARVIS_ACCESS_LAYER_V1_OPERATIONAL_WITH_LIMITATIONS",
  "confidence": "HIGH",
  "limitations": [
    "WAITING_DEPLOY_APPROVAL",
    "Telegram production secrets are not configured by repository code."
  ],
  "unresolved_issues": [
    "Production SHA remains UNKNOWN until this build is deployed."
  ],
  "suggested_next_tasks": [
    "Deploy after approval and configure Telegram webhook."
  ],
  "escalation_needed": {
    "needed": false,
    "reason": null,
    "target_tier": null
  }
}
