{
  "task_id": "TASK_GROQ_LIVE_EVALUATION_ADAPTER_V1",
  "executor": "CODEX",
  "start_time": "2026-09-30T09:30:00+00:00",
  "end_time": "2026-09-30T10:00:00+00:00",
  "files_read": ["server/orchestrator_v1/core/provider_benchmark.py", "server/orchestrator_v1/core/provider_policy.py", "server/orchestrator_v1/provider_policy_registry_v1.json"],
  "files_changed": ["server/orchestrator_v1/core/groq_evaluation.py", "server/orchestrator_v1/core/provider_benchmark.py", "server/app.py", "server/smoke_production_imports.py", "server/tests/test_groq_evaluation_adapter_v1.py", "server/tests/test_production_requirements.py", "docs/NEXUS_GROQ_LIVE_EVALUATION_ADAPTER_V1.md"],
  "tools_or_commands": ["official Groq documentation review", "pytest", "production import smoke", "security preflight", "git"],
  "artifacts_created": ["docs/NEXUS_GROQ_LIVE_EVALUATION_ADAPTER_V1.md"],
  "tests": {"ran": true, "passed": 31, "failed": 0},
  "verifier": {"ran": true, "passed": true, "errors": []},
  "commit": null,
  "push_status": "NOT_PUSHED",
  "decision": "GROQ_LIVE_EVALUATION_ADAPTER_V1_READY_WITH_LIMITATIONS",
  "confidence": "MEDIUM",
  "limitations": ["No live Groq request was made.", "No model was enabled in source control.", "Production routing remains disabled."],
  "unresolved_issues": [],
  "suggested_next_tasks": ["Configure a low Groq quota and run one explicitly approved live evaluation campaign."],
  "escalation_needed": {"needed": false, "reason": null, "target_tier": null}
}
