{
  "task_id": "NEXUS_TASK_0012",
  "executor": "CODEX",
  "start_time": "2026-10-02T07:00:00+00:00",
  "end_time": "2026-10-02T07:00:00+00:00",
  "files_read": [],
  "files_changed": [],
  "tools_or_commands": ["pytest", "production import smoke"],
  "artifacts_created": [
    "LocalAgentBridgeV1",
    "LocalBridge/nexus_agent_bridge.py",
    "docs/NEXUS_LOCAL_AGENT_BRIDGE_V1.md"
  ],
  "tests": {"ran": true, "passed": 509, "failed": 0},
  "verifier": {"ran": true, "passed": true, "errors": []},
  "commit": null,
  "push_status": "NOT_PUSHED",
  "decision": "LOCAL_AGENT_BRIDGE_V1_READY_WITH_LIMITATIONS",
  "confidence": "MEDIUM",
  "limitations": [
    "Telegram-to-Ollama production E2E requires deployment approval and local secret configuration",
    "V1 state storage assumes the existing single-process deployment"
  ],
  "unresolved_issues": [],
  "suggested_next_tasks": [
    "configure the shared bridge secret without committing it",
    "run the controlled single-test-file E2E task"
  ],
  "escalation_needed": {"needed": false, "reason": null, "target_tier": null}
}
