{
  "task_id": "TASK_DIRECT_ESCALATION_PATH_V1",
  "executor": "TIER4_CODEX",
  "start_time": "2026-09-30T08:00:00Z",
  "end_time": "2026-09-30T08:30:00Z",
  "files_read": [
    "server/orchestrator_v1/core/context_packet.py",
    "server/orchestrator_v1/core/result_packet.py",
    "server/orchestrator_v1/core/orchestrator.py",
    "server/orchestrator_v1/core/dispatcher.py",
    "server/orchestrator_v1/core/task_queue.py",
    "contracts/context-packet.schema.json",
    "contracts/result-packet.schema.json",
    "server/Dockerfile"
  ],
  "files_changed": [
    "server/orchestrator_v1/core/context_packet.py",
    "server/orchestrator_v1/core/orchestrator.py",
    "server/orchestrator_v1/core/dispatcher.py",
    "server/orchestrator_v1/core/task_queue.py",
    "server/smoke_production_imports.py",
    "server/tests/test_durable_queue_dispatcher_v1.py",
    "server/tests/test_jarvis_access_layer_v1.py",
    "server/orchestrator_v1/direct_escalation_path_v1_result_packet.json"
  ],
  "tools_or_commands": [
    "pytest direct escalation regression",
    "python server/smoke_production_imports.py",
    "python scripts/check_no_active_example_secrets.py"
  ],
  "artifacts_created": [
    "server/orchestrator_v1/direct_escalation_path_v1_result_packet.json"
  ],
  "tests": {"ran": true, "passed": 96, "failed": 0},
  "verifier": {"ran": true, "passed": true, "errors": []},
  "commit": null,
  "push_status": "NOT_PUSHED",
  "decision": "DIRECT_ESCALATION_PATH_FIXED",
  "confidence": "HIGH",
  "limitations": [
    "No provider connector is invoked; MANUAL_REVIEW remains a terminal escalation handoff.",
    "An already BLOCKED production task is not replayed automatically and requires explicit recovery after deployment."
  ],
  "unresolved_issues": [],
  "suggested_next_tasks": [
    "Deploy only after explicit approval and create a new Telegram research task to verify the production transition.",
    "Review TASK_7035F5E80552 manually; do not auto-replay ambiguous work.",
    "Implement the Provider Connector Layer as a separate approved change."
  ],
  "escalation_needed": {"needed": false, "reason": null, "target_tier": null}
}
