{
  "task_id": "TELEGRAM_INTERACTIVE_UX_V1",
  "executor": "CODEX",
  "start_time": "2026-10-04T00:00:00+00:00",
  "end_time": "2026-10-04T00:00:00+00:00",
  "files_read": [
    "server/jarvis_v1/service.py",
    "server/jarvis_v1/telegram_adapter.py",
    "server/orchestrator_v1/core/task_queue.py",
    "server/orchestrator_v1/agent_capability_registry_v1.json"
  ],
  "files_changed": [
    "server/jarvis_v1/service.py",
    "server/jarvis_v1/telegram_adapter.py",
    "server/tests/test_telegram_interactive_ux_v1.py",
    "docs/NEXUS_TELEGRAM_INTERACTIVE_UX_V1.md",
    "server/orchestrator_v1/telegram_interactive_ux_v1_result_packet.json"
  ],
  "tools_or_commands": ["pytest", "npm test", "npm run build", "git diff --check"],
  "artifacts_created": [
    "Telegram Interactive UX V1",
    "TECHNICAL_DETAILS_V2",
    "contextual callback keyboard",
    "paginated lifecycle projection"
  ],
  "tests": {"ran": true, "passed": 592, "failed": 0},
  "verifier": {"ran": true, "passed": true, "errors": []},
  "commit": null,
  "push_status": "NOT_PUSHED",
  "decision": "JARVIS_TELEGRAM_INTERACTIVE_UX_V1_READY_WITH_LIMITATIONS",
  "confidence": "HIGH",
  "limitations": [
    "Telegram callback acknowledgement remains on the existing send-message transport",
    "agent navigation is bounded to the first eight buttons in V1",
    "provider status is registry-backed and does not perform network probes"
  ],
  "unresolved_issues": [],
  "suggested_next_tasks": [
    "perform a controlled Telegram staging acceptance test after approval",
    "add callback-query acknowledgement if transport telemetry shows UX latency"
  ],
  "escalation_needed": {"needed": false, "reason": null, "target_tier": null}
}
