{
  "task_id": "TASK_PROVIDER_POLICY_REGISTRY_V1",
  "executor": "CODEX",
  "start_time": "2026-09-30T00:00:00+00:00",
  "end_time": "2026-09-30T00:00:00+00:00",
  "files_read": ["server/orchestrator_v1/agent_capability_registry_v1.json", "server/review_pipeline_v1/review_matrix.py", "server/review_pipeline_v1/premium_budget_policy.py"],
  "files_changed": ["contracts/provider-policy-registry.schema.json", "server/orchestrator_v1/provider_policy_registry_v1.json", "server/orchestrator_v1/core/provider_policy.py", "server/app.py", "server/tests/test_provider_policy_registry_v1.py", "docs/NEXUS_PROVIDER_POLICY_REGISTRY_V1.md"],
  "tools_or_commands": ["pytest", "git"],
  "artifacts_created": ["server/orchestrator_v1/provider_policy_registry_v1.json", "docs/NEXUS_PROVIDER_POLICY_REGISTRY_V1.md"],
  "tests": {"ran": true, "passed": 464, "failed": 3},
  "verifier": {"ran": true, "passed": true, "errors": []},
  "commit": null,
  "push_status": "NOT_PUSHED",
  "decision": "PROVIDER_POLICY_REGISTRY_V1_READY_WITH_LIMITATIONS",
  "confidence": "MEDIUM",
  "limitations": ["No free or premium online provider was activated or called.", "Online provider capabilities remain evaluation-only until benchmarked.", "The focused Provider Policy and Connector suite passed 12/12; the repository-wide totals below retain unrelated pre-existing failures."],
  "unresolved_issues": ["Three pre-existing full-suite failures remain: Funding frozen hash drift and two Research Control Plane experiment-count snapshots (expected 8, canonical source currently 9)."],
  "suggested_next_tasks": ["Free Provider Benchmark Engine V1"],
  "escalation_needed": {"needed": false, "reason": null, "target_tier": null}
}
